name,latitude,longitude,address,cluster
OZIO,41.7632975,140.7157414,函館市元町２９−１４,3
丸井栄餅,41.7644101,140.7258013,函館市栄町５−１３,1
あぐりへい屋,41.85439169999999,140.6727644,函館市日本、〒041-1214 北海道北斗市東前６２,3
丸昌,41.7648857,140.7163666,函館市末広町１６−１４,3
地酒・ワイン屋 みのや,41.7997908,140.7344499,函館市亀田町２２−１０,1
道の駅　縄文ロマン 南かやべ,41.92763,140.945506,函館市臼尻町５５１−１,3
道の駅 なとわ・えさん,41.7794481,141.1016252,函館市日ノ浜町３１−２,7
五島軒十字街プロミエル・カモイ店,41.76321599999999,140.718395,函館市末広町５−２０,3
シエスタハコダテ,41.78961869999999,140.7519576,函館市本町２４−１,3
キラリス函館,41.7728862,140.7286019,函館市若松町２０−１,3
まるごと北海道ストア えぞりす,41.77293,140.7286344,函館市若松町２０−１号,1
丸井今井函館店,41.7888689,140.7521452,函館市本町３２−１５,3
HAKOVIVA,41.774427,140.727398,函館市若松町１２−８,3
パティスリージョリ・クレール,41.8218972,140.6523164,函館市日本、〒049-0162 北海道北斗市中央２丁目１−５,3
道の駅 しかべ間歇泉公園,42.0286722,140.8305105,函館市日本、〒041-1402 北海道茅部郡鹿部町鹿部１８−１,3
THE DANSHAKU LOUNGE,41.9256967,140.6579922,函館市日本、〒041-1102 北海道亀田郡七飯町峠下379番3,3
いろは,41.7654159,140.7166685,函館市末広町１４−２,3
ヴィクトリアンローズ　スーベニアショップ（函館市旧イギリス領事館）,41.76594980000001,140.7106585,函館市元町３３−１４ 函館市旧イギリス領事館,3
道の駅 みそぎの郷 きこない,41.67779089999999,140.4354526,函館市日本、〒049-0422 北海道上磯郡木古内町本町３３８−１４ 道の駅 みそぎの郷きこない,3
パン研究所 神戸こむぎ館,41.7860113,140.7631158,函館市松陰町２７−４１,3
THE HAKODATE DEPART,41.7758792,140.8155042,函館市高松町５１１,3
函館西波止場,41.7664254,140.7152089,函館市末広町２４−６,3
函館山ロープウェイ山頂ショップ,41.7594128,140.7045389,函館市函館山函館山（展望台） 内,3
スイーツ&デリカショップ Ashibino,41.7635171,140.7162546,函館市末広町４−５ 五島軒本店,3
