name,latitude,longitude,address,cluster
ラッキーピエロ 函館駅前店,41.77176659999999,140.7255401,函館市若松町８−８ ２階,3
料亭 冨茂登,41.7609869,140.719219,函館市宝来町９−７,1
函館 鮨処 木はら,41.7747147,140.7877146,函館市湯川町２丁目１−２,1
津軽屋食堂,41.7726597,140.7301828,函館市松風町７−６,1
梅乃寿司 さくら通り,41.7865752,140.7637801,函館市柏木町１−19号,1
ラーメン 津つ井軒,41.7721689,140.7270363,函館市若松町７−１１,1
函館麺や一文字 総本店,41.7748946,140.7878955,函館市湯川町２丁目１−３,1
きんぎょ茶屋,41.7665903,140.7121946,函館市末広町２０−１８,1
欧風料理屋　紫ぜん,41.7662498,140.7194384,函館市豊川町１０−１０,2
函館麺厨房あじさいJR函館駅店,41.77358819999999,140.7260562,函館市若松町１２−１３ JR函館駅2階,1
ビストロやまくろ,41.76520250000001,140.7254003,函館市栄町１１−４ 11-4 2F,1
朝市食堂　函館ぶっかけ,41.77259,140.725759,函館市若松町９−１５,1
蛸焼 こがね,41.7616939,140.7197558,函館市宝来町２２−１,1
手打ちうどん そば　上野,41.7794335,140.7802831,函館市湯川町１丁目２３−６,1
レストラン ヨシヤ,41.7715981,140.704589,函館市弁天町５−６,1
ラーメン maido,41.7796454,140.7845116,函館市湯川町１丁目２６−３４,1
魚河岸酒場　魚一心,41.7710873,140.731966,函館市松風町３−１１,1
朝市お食事処 山三 道下商店,41.7726822,140.7255353,函館市若松町９−１５ 函館朝市どんぶり横丁,1
函館麺厨房あじさい　本店,41.7946641,140.7532456,函館市五稜郭町２９−２２,1
朝市の味処 茶夢,41.7727187,140.7253522,函館市若松町９−１５ どんぶり横丁市場内,1
和風とんかつ専門店 とん悦,41.761824,140.719714,函館市宝来町２２−２,1
居酒屋 山吹,41.770146,140.731235,函館市東雲町１８−８,1
函館 千秋庵総本家 宝来町本店,41.7611078,140.7194447,函館市宝来町９−９,3
ザ・ベリー・ベリー・ビースト,41.7623612,140.7206154,函館市宝来町２３−３,2
うなぎ処 高はし,41.799877,140.753207,函館市五稜郭町２４−６,1
函館山山頂展望台テイクアウトコーナー,41.7595149,140.7044159,函館市函館山函館山（展望台） 内,3
茶店バー　カフェ　やまじょう,41.76367359999999,140.7141513,函館市元町３０−５,3
新函館ラーメン マメさん（2023年8月閉店）,41.7623218,140.7193732,函館市宝来町２２−６ 22番地6番地,1
はこだて海鮮市場 いかいか亭,41.7670284,140.7190248,函館市豊川町１２−１２ はこだて海鮮市場本店,3
レイモンハウス元町店（グルメ）,41.7636486,140.7143058,函館市元町３０−３ 函館カールレイモン,3
蕎麦蔵,41.77091110000001,140.7033991,函館市弥生町２３−５,1
ハコダテソフトハウス元町　北櫻茶,41.7642079,140.7110812,函館市元町１４−４,3
ROMANTiCO ROMANTiCA,41.7715981,140.7082038,函館市弁天町１５−１２,1
一花亭　たびじ,41.7727043,140.7254987,函館市若松町９−１５ どんぶり横丁市場内,1
茶房　無垢里（グルメ）,41.7649702,140.7107859,函館市元町１３−１４,2
食の宝庫 北海道,41.7735679,140.7261039,函館市若松町１２,3
コーヒールーム きくち,41.7776932,140.7931879,函館市湯川町３丁目１３−１９,3
日本最古のストーブ,41.7636903,140.7169607,函館市末広町４−１９,8
鳥崎八景,42.0467969,140.4886583,函館市日本、〒049-2324 北海道茅部郡森町栗ヶ丘,4
日本基督教団函館教会,41.764563,140.713434,函館市元町３１−１９ 函館教会,9
兵糧庫,41.79675400000001,140.7556868,函館市五稜郭町４４−２,9
青函連絡船ゆかりの錨,41.7724623,140.7220913,函館市若松町１２,9
桜見本園,41.4321127,140.1092076,函館市日本、〒049-1511 北海道松前郡松前町松城,7
大千軒岳,41.5792927,140.1608332,函館市日本、〒049-1521 北海道松前郡松前町上川 大千軒岳,4
姥神大神宮,41.8665096,140.1250151,函館市日本、〒043-0041 北海道檜山郡江差町姥神町９８−９９番地,10
旧旅籠町界隈,41.7701017,140.7047431,函館市弥生町２２−２２ 幸坂,8
亀井勝一郎文学碑,41.7597978,140.7173901,函館市青柳町２５,10
高田屋嘉兵衛一族の墓・顕彰碑,41.7689029,140.7013987,函館市船見町１８,8
遺愛学院（旧遺愛女学校）本館・旧宣教師館,41.78579130000001,140.7570468,函館市杉並町２３,9
旧第一銀行函館支店（函館市文学館）,41.7663509,140.7132732,函館市末広町２２−５,9
函館 漁船クルーズ,41.7715002,140.6996861,函館市入舟町４−４,7
七飯町歴史館,41.8972,140.6952,函館市日本、〒041-1111 北海道亀田郡七飯町本町６丁目１−３,6
サンタロナカセ岩,41.7393693,141.0691832,函館市豊浦町,7
鯨族供養塔,41.7693528,140.7030311,函館市弥生町９,10
金森ホール,41.76636079999999,140.716024,函館市末広町１４−１２,4
東北以北最古のエレベーター,41.7636903,140.7169607,函館市末広町４−１９,4
本願寺函館別院（西本願寺）,41.76384719999999,140.7227051,函館市東川町１２−１２,10
函館湯の川球場跡地,41.7755169,140.7955863,函館市湯川町３丁目６,4
禅燈寺の仁王像,41.671247,140.4097676,函館市日本、〒049-0455 北海道上磯郡木古内町鶴岡１０３,10
旧金森船具店,41.7662419,140.7156496,函館市末広町１４−１２,9
南部坂,41.76553870000001,140.7150736,函館市末広町,7
榎本軍鷲ノ木上陸地跡,42.118998,140.538469,函館市日本、〒049-2321 北海道茅部郡森町鷲ノ木町１６１,8
江差追分会館・江差山車会館,41.868689,140.126652,函館市日本、〒043-0034 北海道檜山郡江差町中歌町１９３−３,6
函館フットボールパーク,41.8030016,140.7901881,函館市日吉町４丁目１９−１９番１,4
東坂,41.7723226,140.7146067,函館市大町,7
着てそぞろ（あつらえ庵）,41.7588956,140.7180948,函館市青柳町２４−１７,2
函館ゴルフ倶楽部,41.7931836,140.8062801,函館市見晴町５８,5
360 Studio,41.7728862,140.7286019,函館市若松町２０−１,6
かもめ島キャンプ場,41.8692897,140.1145802,函館市日本、〒043-0045 北海道檜山郡江差町鴎島,7
佐女川神社,41.6822824,140.4318844,函館市日本、〒049-0431 北海道上磯郡木古内町木古内１５５−１,10
函館空港,41.7757043,140.8158222,函館市高松町５１１,4
すずらんの丘公園パークゴルフ場,41.8074014,140.8068648,函館市滝沢町９３,4
函館四天王像,41.7654935,140.7093793,函館市元町１２−１８,10
湯の沢水辺公園,41.7946534,140.5494334,函館市日本、〒049-0285 北海道北斗市茂辺地市ノ渡,5
函館市戸井ウォーターパーク　オートキャンプ場,41.73186049999999,141.0306267,函館市原木町２８１,5
Blue Berry Farm HONDA（ブルーベリー狩り）,41.8364512,140.7853537,函館市陣川町８２−７２,3
FMいるかオープンスタジオ,41.7608204,140.7142358,函館市元町１９−７,6
空港緑地　志海苔ふれあい広場パークゴルフ場,41.76913709999999,140.8178551,函館市志海苔町２９４−１,4
鶉ダムオートキャンプ場ハチャムの森,41.947963,140.38611,函館市日本、〒043-1234 北海道檜山郡厚沢部町木間内６０−１,4
函館市民スケート場,41.7780305,140.764505,函館市金堀町１０−８,5
函館競輪場,41.7768543,140.7630258,函館市金堀町１０−８,9
函館パークカントリークラブ,41.8215499,140.8198069,函館市東山町１８５−１,5
青柳市民庭球場,41.7581981,140.713359,函館市青柳町９−９,5
千代台公園庭球場,41.785995,140.748242,函館市千代台町２７−２,5
白石公園パークゴルフ場,41.7569938,140.9006563,函館市白石町２０８,4
オートリゾート八雲,42.2289687,140.3076799,函館市日本、〒049-3124 北海道二海郡八雲町浜松３６８,4
函館護國神社,41.759291,140.7133523,函館市青柳町９−２３,8
北海道立函館美術館,41.7935857,140.7548018,函館市五稜郭町３７−６,6
元町教会群,41.7632656,140.7129206,函館市元町１５−３０ 元町教会,4
新選組最後の地碑,41.7728931,140.7042033,函館市入舟町６−６,10
石川啄木一族の墓,41.7474858,140.7194496,函館市住吉町１６,10
赤い靴の少女像,41.7661664,140.7145647,函館市末広町２３,10
北海道坂本龍馬記念館,41.7639457,140.7185921,函館市末広町８−６,6
西ふ頭,41.7748137,140.7106819,函館市弁天町２０,4
旧金森洋物店（市立函館博物館郷土資料館）,41.7661092,140.7128753,函館市末広町１９−１５,6
箱館高田屋嘉兵衛資料館,41.7658758,140.7176039,函館市末広町１３−２２,6
日暮山展望台,41.98038270000001,140.6436862,函館市日本、〒041-1355 北海道亀田郡七飯町西大沼,7
住三吉神社,41.748948,140.7159762,函館市住吉町１−７,10
活火山「恵山」,41.8047921,141.1660736,函館市御崎町 恵山,7
外国人墓地,41.7681153,140.6969092,函館市船見町２３,10
市立函館博物館,41.7559785,140.7147983,函館市青柳町１７−１,6
函館市北方民族資料館,41.7671515,140.7119756,函館市末広町２１−７,6
二十間坂,41.76553870000001,140.7150736,函館市末広町,7
厳島神社,41.7725714,140.7043355,函館市弁天町９−９,10
北島三郎記念館（閉館）,41.5983052,140.4190339,函館市日本、〒049-1103 北海道上磯郡知内町重内２１−１ ２階ロビ,6
燈台の聖母 トラピスト修道院,41.7402679,140.5692137,函館市日本、〒049-0283 北海道北斗市三ツ石３９２,7
ザ・グラススタジオイン函館（吹きガラス体験）,41.7653703,140.7168263,函館市末広町１４−２,2
五稜郭公園の貸ボート,41.7951945,140.7558488,函館市五稜郭町４４−５,2
旧函館区公会堂 はこだてハイカラ衣裳館,41.7650379,140.7090998,函館市元町１１−１３ 旧函館区公会堂内,2
函館聖ヨハネ教会,41.7625304,140.7127964,函館市元町３−２３ 聖ヨハネ教会,9
函館大沼セグウェイツアー,41.99403820000001,140.6422063,函館市日本、〒041-1355 北海道亀田郡七飯町西大沼 温泉 函館大沼プリンスホテル内,5
クラフトベース モノクラ,41.7655897,140.7164533,函館市末広町１４−５ クラフトベース モノクラ,3
八郎沼公園,41.88894639999999,140.6144133,函館市日本、〒041-1231 北海道北斗市向野１３２,7
大沼レイクゴルフクラブ,42.0118427,140.6459402,函館市日本、〒049-2142 北海道茅部郡森町赤井川２５２,5
函館カール・レイモン（工場見学）,41.809599,140.813303,函館市鈴蘭丘町３−９２,3
カネモリブリックラボ,41.76655309999999,140.7169989,函館市 北海道 040-0053 日本,5
函館七飯スノーパーク,41.986998,140.7469165,函館市日本、〒041-1351 北海道亀田郡七飯町東大沼６６６,7
ゴシケヴィッチ胸像,41.7637261,140.716927,函館市末広町４−１９,10
旧函館西警察署庁舎（函館市臨海研究所）,41.77079579999999,140.7100218,函館市大町１３−１,9
大圓寺,41.8143064,140.7650484,函館市神山３丁目４−１ 大円寺,8
夷王山,41.801277,140.096275,函館市日本、〒049-0601 北海道檜山郡上ノ国町勝山 夷王山,7
旧小林写真館,41.7682662,140.709954,函館市大町２−９,9
北海道第一歩の地碑,41.76737799999999,140.7133674,函館市末広町２４,10
石川啄木歌碑（青柳町）,41.7605096,140.7171189,函館市青柳町１４−１４,10
高田屋本店跡,41.76197459999999,140.7210251,函館市宝来町２４−２４,8
石川啄木居住地跡,41.7588644,140.7170219,函館市青柳町１５,10
榎本武揚之像,41.79287,140.7479762,函館市梁川町２５,10
函館市公民館,41.75979869999999,140.7156639,函館市青柳町１２−１７ 函館市公民館,9
【2024年10月31日閉館】石川啄木函館記念館（土方・啄木浪漫館）,41.7727835,140.7549114,函館市日乃出町２５−４,6
千畳敷,41.74688019999999,140.7078414,函館市函館山,7
木古内町郷土資料館（いかりん館）,41.671342,140.412842,函館市日本、〒049-0455 北海道上磯郡木古内町鶴岡７４−１,10
武田斐三郎先生顕彰碑,41.79649949999999,140.7559786,函館市五稜郭町４４,8
箱館戦争の大砲,41.7911785,140.7367516,函館市八幡町３−２,8
湯の川温泉発祥の地碑,41.78132,140.7913033,函館市湯川町２丁目２９−１,8
千代台公園陸上競技場,41.7863051,140.7451362,函館市千代台町２２−２４,5
大沼国際カントリークラブ,42.02745540000001,140.7548639,函館市日本、〒041-1405 北海道茅部郡鹿部町駒見４９−１０,5
大沼公園スノーシューツアー,41.98384729999999,140.6721442,函館市日本、〒041-1354 北海道亀田郡七飯町大沼町,5
【休業中】函館手造りいか工房いかベイ,41.7664314,140.7152261,函館市末広町２４−６,3
函館市民プール,41.786688,140.7467267,函館市千代台町２２−２５,5
函館フェリーターミナル,41.8075807,140.7105434,函館市港町３丁目１９−２,4
箱館奉行所,41.7969003,140.7566438,函館市五稜郭町４４−３,9
恵山つつじ公園,41.79248510000001,141.1541612,函館市柏野町,7
【2024年10月31日閉館】土方歳三凾館記念館（土方・啄木浪漫館）,41.7727835,140.7549114,函館市日乃出町２５−４,6
碧血碑,41.7518014,140.7085648,函館市谷地頭町１,10
ペリー提督来航記念碑,41.76617969999999,140.7098503,函館市弥生町２,10
函館山,41.75929410000001,140.703917,函館市 函館山,7
函館山の砲台跡（旧函館要塞）,41.756727,140.7015486,函館市函館山０４０ 0000,10
函館八幡宮,41.75386769999999,140.7098647,函館市谷地頭町２−５,10
函館市青函連絡船記念館摩周丸,41.77289080000001,140.7217883,函館市若松町１２−１２番地先,9
夷王山キャンプ場,41.79651519999999,140.096543,函館市日本、〒049-0601 北海道檜山郡上ノ国町勝山５２０,4
ニヤマ高原スキー場,41.986998,140.7469165,函館市日本、〒041-1351 北海道亀田郡七飯町東大沼６６６,4
鹿部カントリー倶楽部,42.073391,140.77104,函館市日本、〒041-1404 北海道茅部郡本別 鹿部町本別530-248,5
函館ベイコーストカントリークラブ,41.81036290000001,140.6061004,函館市日本、〒049-0133 北海道北斗市柳沢 柳沢３２３−１,5
根崎公園ラグビー場,41.7762164,140.7949906,函館市湯川町３丁目６,4
海峡横綱ビーチ,41.4822145,140.2617883,函館市日本、〒049-1321 北海道松前郡福島町月崎２０,5
函館フットボールパーク　テニスコート,41.8021512,140.7940437,函館市日吉町４丁目７−１,4
【閉鎖】函館シーサイドカントリークラブ,41.7868058,140.8672303,函館市豊原町２３７,5
恵山シーサイドパークゴルフ場,41.78617959999999,141.0955805,函館市高岱町６８−４,4
函館市国際水産・海洋総合研究センター,41.7819685,140.7032397,函館市弁天町２０−５,7
函館アリーナ展示スペース（GLAY関連など）,41.7819528,140.7835209,函館市湯川町１丁目３２−２,6
石川啄木歌碑,41.7572448,140.7161634,函館市青柳町１７,10
中島三郎助父子最後之地,41.7872278,140.7431644,函館市中島町３６,10
土方歳三ブロンズ像,41.7949434,140.7542515,函館市五稜郭町４３−９,10
旧桟橋（東浜桟橋）,41.772673,140.7214593,函館市若松町１２−１９,9
大三坂,41.7639808,140.7142833,函館市 大三坂,7
函館市電 駒場車庫,41.7822323,140.7790374,函館市駒場町１５−１ 市電駒場車庫,9
ふれあいイカ広場,41.7725567,140.7220195,函館市若松町１２−１９,9
Green Forest Cafe,41.7662229,140.7115619,函館市末広町２０−３,3
優鮨【2023年12月閉店】,41.917145,140.95848,函館市安浦町９０−１,1
季肴酒,41.7859623,140.7495262,函館市本町１−４７,1
【2024/10/15閉店】gram ベイエリア函館店,41.7651406,140.7178604,函館市末広町１２−３,1
和Dining 井井,41.7659878,140.7172474,函館市末広町１３−５,3
ヤマタ たちか屋,41.7878543,140.7514491,函館市本町３２−４,1
【2024/8/3閉店】カフェ＆レストランBUZZ（バズ）,41.7873998,140.7514523,函館市本町３２−３７ 清野ビル 1階,1
LAMB'S EAR,41.7880356,140.7433098,函館市中島町３８−１１,1
鮨処あうん亭 光,41.7867225,140.7428883,函館市中島町３６−１６,1
二代目 佐平次,41.7939266,140.7513984,函館市五稜郭町４−１３ 五洋ビル,1
丸善 瀧澤商店,41.7730696,140.7292573,函館市若松町１９−７,1
旬味 千,41.7922193,140.7506693,函館市梁川町２２−２２,1
懐石の里 煌,41.7477312,140.7163759,函館市住吉町１７−１ 割烹煌,1
ビアバー山下,41.7647135,140.7157927,函館市末広町１６−３,2
蔵や,41.7631604,140.7189197,函館市末広町７−７,1
鯉之助,41.788686,140.751703,函館市本町３２−１１,1
ル・モン・ガギュー（函館国際ホテル）,41.7698234,140.72162,函館市大手町５−１０ 函館国際ホテル 8階 西館,2
スープカリー喰堂 吉田商店,41.776143,140.7382233,函館市新川町２４−１,1
寿しレストラン ひでちゃん鮨,41.9067148,140.9719601,函館市川汲町１４２３−３,1
Cafe&Restaurant Bees.Bee,41.79040730000001,140.7711418,函館市柏木町３９−３,1
炭火焼肉・ジンギスカン 炭火亭,41.7898788,140.7529616,函館市本町２２−２８,1
ANTICA OSTERIA DELL'ALBA,41.791704,140.776248,函館市本通３丁目２−１２,1
サーフサイド,41.8448494,141.1420898,函館市銚子町１００−４,3
表・びんごや,41.7886641,140.7516967,函館市本町３２−１０,1
イタリアンゴーゴー,41.766093,140.717422,函館市末広町１３−２０,1
はこだてわいん葡萄館本店,41.9104525,140.6810515,函館市日本、〒041-1104 北海道亀田郡七飯町上藤城11番地,3
Pain屋,41.7623893,140.7200066,函館市宝来町２２−１２,1
プティ・メルヴィーユ赤レンガ倉庫BAYはこだて店,41.7666991,140.7174642,函館市豊川町１１−５,3
古きものなどなど ひし伊,41.7608606,140.7188587,函館市宝来町９−４,3
NORTH SAKE & WINE 酒舗 稲村屋,41.903902,140.648765,函館市日本、〒041-1242 北海道北斗市市渡１丁目１−７ 観光交流センター別館 内,3
こなひき小屋,41.8947058,140.6919945,函館市日本、〒041-1111 北海道亀田郡七飯町本町４丁目１−５５,3
山田農場,41.9590745,140.7066501,函館市日本、〒041-1353 北海道亀田郡七飯町上軍川９００−１,3
おおば製パン,42.0209423,140.6326564,函館市日本、〒049-2142 北海道茅部郡森町赤井川４１２−１３２,3
十字屋珈琲店,41.7724718,140.7256396,函館市若松町９−１９,3
BENTO CAFE 41°GARDEN,41.9043522,140.6486591,函館市日本、〒041-1242 北海道北斗市市渡１丁目１−１,3
ヒュッテ,41.92587559999999,140.6367863,函館市日本、〒041-1101 北海道亀田郡七飯町仁山461ｰ6,3
NANAIRO FACTORY,41.9259845,140.6571624,函館市日本、〒041-1102 北海道亀田郡七飯町峠下 道の駅なないろ・ななえ,3
レイモンハウス元町店（みやげ店）,41.7636486,140.7143058,函館市元町３０−３ 函館カールレイモン,3
函館洋菓子スナッフルス函館エキナカ店,41.77372140000001,140.7263446,函館市若松町１２−１３,3
手づくりパンの家 ムックル,41.78200189999999,140.7450631,函館市千代台町１２−２５,1
ギャラリー村岡,41.7624863,140.7133673,函館市元町２−７,2
市中屋,41.7528932,140.7159697,函館市谷地頭町２６−１１,3
シュークリームの専門店 ママデコレ,41.7654333,140.7155489,函館市末広町２３−２１,1
餅の北屋,41.78932289999999,140.7526493,函館市本町２５−１２,3
日和館,41.7642776,140.7104945,函館市元町１０−１３,3
いるか文庫ショップ,41.7738554,140.7264375,函館市若松町１２−１３,6
道の駅 しりうち,41.6012589,140.3358339,函館市日本、〒049-1221 北海道上磯郡知内町字湯の里４８−１３,3
八雲町情報交流物産館「丘の駅」,42.2268589,140.3143603,函館市日本、〒049-3124 北海道二海郡八雲町浜松３６８−８,3
道の駅 あっさぶ,41.916638,140.2163282,函館市日本、〒043-1112 北海道檜山郡厚沢部町緑町７２−１,3
Chouette Cacao,41.79437469999999,140.7486196,函館市梁川町２７−１６,3
パティスリー ラパン・ド・ネージュ,41.7691182,140.7267993,函館市大手町１６−１,3
パン工房　元町ぼん・ぱん,41.7645814,140.7160848,函館市末広町１６−１,3
モンモランシー（函館国際ホテル）,41.769564,140.722278,函館市大手町５−１０,3
天然酵母パン　tombolo,41.7637724,140.7141989,函館市元町３０−６,3
気ままなパン屋　窯蔵,41.75321839999999,140.7161631,函館市谷地頭町２５−１８,1
はこだて恋いちご洋菓子店,41.7651393,140.7165853,函館市末広町１５−１ ルネッサンス 末広 1階,3
プティ・メルヴィーユ函館駅前店,41.77408269999999,140.7274855,函館市若松町１２−８,3
ヤマチュウ食品 日乃出店,41.7720203,140.7494734,函館市日乃出町１−２,1
ブーランジェリー エプイ,41.98064290000001,140.6693416,函館市日本、〒041-1354 北海道亀田郡七飯町大沼町８５−９,3
三月の羊,41.99161269999999,140.6952875,函館市日本、〒041-1353 北海道亀田郡七飯町上軍川９−１１,3
旧函館区公会堂売店（函館みやげ はこぱこ）,41.7650219,140.7089348,函館市元町１１−１３ 旧函館区公会堂内,3
雑貨屋pente,41.8367482,140.7296486,函館市桔梗２丁目１２−５,3
にっぽんCHACHACHA 函館ストア,41.7663232,140.7172023,函館市末広町１３−９ 金森洋物館,3
イチマス,41.779827,140.785037,函館市湯川町１丁目２６−２９,3
六花亭 漁火通店,41.77467439999999,140.7653101,函館市金堀町９−9番18号,3
プティ・メルヴィーユ本通店,41.7958338,140.7748328,函館市本通３丁目２５−２５,3
ホタルぱん,41.7578317,140.7203602,函館市宝来町２−５,1
はこだて工芸舎,41.764021,140.7190035,函館市末広町８−８,3
Angélique Voyage,41.7679664,140.7091657,函館市弥生町３−１１,3
ロシア・東欧雑貨直輸入店 チャイカ,41.7641331,140.7106453,函館市元町７−７,3
道の駅 横綱の里ふくしま,41.4796138,140.255714,函館市日本、〒049-1312 北海道松前郡福島町福島１４３−１,3
中華料理 李太白,41.7894697,140.7413712,函館市宮前町３０−２,1
Jolly Jellyfish,41.8076976,140.7719624,函館市東山２丁目６−１,3
函館海鮮料理 海光房,41.7728989,140.7243368,函館市若松町１１−８,1
おひるごはんカフェ taom,41.7648892,140.718445,函館市末広町９−９ カルチャーセンター 臥牛館 1F,3
Hakodate Dining 備後屋,41.78952020000001,140.7550407,函館市本町２８−１５ 備後屋,3
四季海鮮 旬花,41.7947628,140.7538416,函館市五稜郭町４３−９ 五稜郭タワー２階,1
Flower Picnic Cafe,41.76404950000001,140.7108708,函館市元町７−９,3
茶蔵,41.7844734,140.7505076,函館市時任町５−４,1
麓 ROKU（Villa Concordia Resort&Spa）,41.763059,140.7171099,函館市末広町３−５,1
CAFE&BAR LYCORIS,41.7948434,140.733474,函館市亀田町１４−１１,1
Glacier ‘c’est chouette !,41.7944716,140.7490399,函館市五稜郭町７−８,3
COFFEEマルシェ,41.7733017,140.7344734,函館市新川町１−２,1
日本料理 うなぎ 松前（函館国際ホテル）,41.7696192,140.7222911,函館市大手町５−１０ 函館国際ホテル東館2階,3
そばと酒 柏木町三貞,41.78771049999999,140.7660488,函館市柏木町７−３２,1
洋風居酒屋 南部坂（2022年閉店）,41.7629257,140.7169967,函館市末広町３−４,3
炉ばた 炉辺人,41.791356,140.750574,函館市本町１０−１１,1
四季　粋花亭,41.7906064,140.7544758,函館市本町２０−６,1
地元家（JIMOTO-YA）,41.7888545,140.7512515,函館市本町５−１６,1
すきやき しゃぶしゃぶ 牛兵衛,41.7862718,140.7495466,函館市本町１−４４,1
居酒屋 庄平,41.7880852,140.7658513,函館市柏木町６−４３,3
炭火割烹 菊川,41.79212709999999,140.7522682,函館市五稜郭町３２−１９ 久米センタービル 1F,1
【休業中】レストラン バスク,41.7852122,140.7582858,函館市松陰町１−４,1
北前船 松前,41.42652569999999,140.1070574,函館市日本、〒049-1506 北海道松前郡松前町唐津３７９,3
SUQ+,41.75988529999999,140.7227776,函館市宝来町２７−１３,2
デイスパ プアマナ 大手町店,41.7697541,140.7237642,函館市大手町６−７ メゾンパティオ大手町,3
710candle,41.7531373,140.7161271,函館市谷地頭町２５−１６,2
南かやべ漁協 直販加工センター,41.90418859999999,140.9705788,函館市川汲町１５４６−１２,3
Endeavour To Go 二十間坂,41.7643024,140.7157968,函館市末広町１７−１５,3
はこだてわいん葡萄館西部店,41.7667251,140.7173408,函館市豊川町１１−５ BAYはこだて 内,3
